{
  "$schema": "https://json-schema.org/draft/2020-12/schema",
  "$comment": "Generated from scripts/qa_contracts.py; do not edit manually.",
  "x-rule-version": "2.16.0",
  "title": "Requirement Knowledge Model",
  "type": "object",
  "additionalProperties": false,
  "required": [
    "requirement_id",
    "title",
    "domain",
    "status",
    "related_tables",
    "used_fields",
    "related_logic_ids",
    "related_metric_ids",
    "related_requirements",
    "changed_items",
    "report_path",
    "effective_version"
  ],
  "properties": {
    "requirement_id": {
      "type": "string",
      "minLength": 1
    },
    "title": {
      "type": "string",
      "minLength": 1
    },
    "domain": {
      "type": "string",
      "minLength": 1
    },
    "status": {
      "enum": [
        "active_confirmed",
        "candidate",
        "conflicting",
        "superseded",
        "deprecated",
        "missing"
      ]
    },
    "related_tables": {
      "type": "array",
      "items": {
        "type": "string",
        "minLength": 1
      },
      "minItems": 0,
      "uniqueItems": true
    },
    "used_fields": {
      "type": "array",
      "items": {
        "type": "string",
        "minLength": 1
      },
      "minItems": 0,
      "uniqueItems": true
    },
    "related_logic_ids": {
      "type": "array",
      "items": {
        "type": "string",
        "minLength": 1
      },
      "minItems": 0,
      "uniqueItems": true
    },
    "related_metric_ids": {
      "type": "array",
      "items": {
        "type": "string",
        "minLength": 1
      },
      "minItems": 0,
      "uniqueItems": true
    },
    "related_requirements": {
      "type": "array",
      "items": {
        "type": "string",
        "minLength": 1
      },
      "minItems": 0,
      "uniqueItems": true
    },
    "changed_items": {
      "type": "array",
      "items": {
        "type": "string",
        "minLength": 1
      },
      "minItems": 0,
      "uniqueItems": true
    },
    "report_path": {
      "type": [
        "string",
        "null"
      ]
    },
    "effective_version": {
      "type": "string",
      "minLength": 1
    }
  }
}
